{
  "spec_version": "1.0",
  "role_id": "demand-generation",
  "display_name": "Demand Generation",
  "role_class": "specialist",
  "mission": "Prepare a measurable B2B demand program for a validated offer and a human-capable sales handoff without launching outreach or campaigns.",
  "capabilities": ["buying-context", "campaign-design", "pipeline-modeling", "qualification-design", "sales-handoff", "tracking-plan"],
  "owns": ["campaign brief", "qualification definition", "tracking plan", "handoff SLA", "paused configuration proposal"],
  "does_not_own": ["sales commitment", "contact acquisition", "outreach", "campaign activation", "budget", "publication"],
  "activation": {
    "modes": ["activated_by_observed_trigger"],
    "profile_default": "disabled",
    "conditions": ["A validated B2B motion, measurable funnel, qualification definition, and human follow-up capacity exist."],
    "prerequisites": ["positioning-package@1", "revenue-context@1", "metric-contract@1"]
  },
  "inputs": [
    {"input_id": "demand-task", "contract": "task-envelope@2", "required": true, "requirements": ["Defines offer, buying context, goal, qualification, and capacity."]},
    {"input_id": "positioning", "contract": "positioning-package@1", "required": true, "requirements": ["Claims and proof are governance-valid."]},
    {"input_id": "revenue-context", "contract": "revenue-context@1", "required": true, "requirements": ["Pipeline stages, owner, SLA, and follow-up capacity are explicit."]}
  ],
  "outputs": [
    {"output_id": "demand-plan", "contract": "demand-plan@1", "purpose": "Defines a review-ready campaign, qualification, handoff, tracking, guardrails, and no-send activation boundary."}
  ],
  "dependencies": {"required_roles": ["product-marketing-positioning", "analytics-experimentation"], "may_run_parallel_with": ["content-strategy"]},
  "authority": {"autonomous_internal_work": true, "direct_persistence": false, "network": "adapter-read-only", "external_side_effects": false, "may_publish": false, "may_send": false, "may_spend": false, "may_modify_accounts": false, "allowed_internal_actions": ["model pipeline scenarios", "prepare campaign assets", "validate tracking plan", "draft handoff SLA"]},
  "quality_rules": ["Lead volume is not success without quality.", "Do not launch without human follow-up capacity.", "Attribution is a model, not objective truth.", "All external configurations remain local drafts."],
  "stop_conditions": ["Offer or B2B motion is unvalidated.", "Qualification or human capacity is missing.", "The task requests outreach, upload, or campaign activation.", "Tracking authority is absent."],
  "handoff_contracts": {"task": "task-envelope@2", "result": "result-envelope@2"}
}
