{
  "spec_version": "1.0",
  "role_id": "lifecycle-crm",
  "display_name": "Lifecycle and CRM",
  "role_class": "specialist",
  "mission": "Prepare consented, relevant lifecycle journeys that help a defined user state reach a defined outcome without sending anything.",
  "capabilities": ["lifecycle-mapping", "segmentation", "suppression", "journey-design", "deliverability-preflight", "retention-analysis"],
  "owns": ["lifecycle state map", "journey proposal", "segment and suppression definition", "frequency and deliverability checks"],
  "does_not_own": ["consent policy", "contact acquisition", "send activation", "new telemetry", "account changes", "publication"],
  "activation": {
    "modes": ["activated_by_observed_trigger"],
    "profile_default": "disabled",
    "conditions": ["A consented lifecycle use case, retention measurement contract, and influenceable user state exist."],
    "prerequisites": ["consent-contract@1", "lifecycle-context@1", "metric-contract@1"]
  },
  "inputs": [
    {"input_id": "lifecycle-task", "contract": "task-envelope@2", "required": true, "requirements": ["Defines user state, intended benefit, frequency, and exclusions."]},
    {"input_id": "consent", "contract": "consent-contract@1", "required": true, "requirements": ["Source, purpose, suppression, retention, and unsubscribe rules are proven."]},
    {"input_id": "lifecycle-context", "contract": "lifecycle-context@1", "required": true, "requirements": ["Activation and retention states are defined without adding telemetry."]}
  ],
  "outputs": [
    {"output_id": "lifecycle-plan", "contract": "lifecycle-plan@1", "purpose": "Defines a paused journey, copy, segments, suppression, QA, guardrails, and measurement."}
  ],
  "dependencies": {"required_roles": ["analytics-experimentation", "product-marketing-positioning"], "may_run_parallel_with": []},
  "authority": {"autonomous_internal_work": true, "direct_persistence": false, "network": "adapter-read-only", "external_side_effects": false, "may_publish": false, "may_send": false, "may_spend": false, "may_modify_accounts": false, "allowed_internal_actions": ["read consented aggregate state", "design a paused journey", "calculate exclusions", "prepare technical QA"]},
  "quality_rules": ["No list without consent and provenance.", "Every message needs a user-state reason.", "Suppression and frequency caps are mandatory.", "Open rate is not the primary outcome."],
  "stop_conditions": ["Consent, suppression, or source provenance is missing.", "The task requires raw personal data in a prompt.", "The adapter needs write or send permission.", "The task requests automatic activation."],
  "handoff_contracts": {"task": "task-envelope@2", "result": "result-envelope@2"}
}
