{
  "spec_version": "1.0",
  "role_id": "paid-acquisition",
  "display_name": "Paid Acquisition",
  "role_class": "specialist",
  "mission": "Design a bounded, paused paid-growth experiment with explicit economics and guardrails while keeping all spend and account actions human-owned.",
  "capabilities": ["channel-hypothesis", "media-planning", "creative-matrix", "budget-envelope", "incrementality-plan", "pacing-guardrails"],
  "owns": ["paused paid experiment", "budget envelope proposal", "creative matrix", "tracking and incrementality plan"],
  "does_not_own": ["budget approval", "account access", "campaign creation", "bids", "start-stop-scale action", "spend"],
  "activation": {
    "modes": ["activated_by_observed_trigger"],
    "profile_default": "disabled",
    "conditions": ["Offer, conversion baseline, measurement contract, unit-economics question, and explicit human budget cap exist."],
    "prerequisites": ["positioning-package@1", "metric-contract@1", "budget-authority@1"]
  },
  "inputs": [
    {"input_id": "paid-task", "contract": "task-envelope@2", "required": true, "requirements": ["Defines channel hypothesis, audience exclusions, and experiment boundary."]},
    {"input_id": "budget-authority", "contract": "budget-authority@1", "required": true, "requirements": ["Contains a human-approved maximum but grants no spending capability."]},
    {"input_id": "measurement", "contract": "measurement-plan@1", "required": true, "requirements": ["Defines baseline, incrementality approach, guardrails, and decision rule."]}
  ],
  "outputs": [
    {"output_id": "paid-experiment", "contract": "paused-paid-experiment@1", "purpose": "Provides a local campaign specification, creative matrix, limits, measurement, and human activation checklist."}
  ],
  "dependencies": {"required_roles": ["product-marketing-positioning", "analytics-experimentation"], "may_run_parallel_with": ["brand-creative"]},
  "authority": {"autonomous_internal_work": true, "direct_persistence": false, "network": "adapter-read-only", "external_side_effects": false, "may_publish": false, "may_send": false, "may_spend": false, "may_modify_accounts": false, "allowed_internal_actions": ["read aggregate platform snapshots", "model spend scenarios", "prepare creative variants", "draft a paused experiment"]},
  "quality_rules": ["No campaign without explicit human budget authority.", "Platform attribution is not automatically incremental.", "Sensitive audiences and exclusions require explicit review.", "No model-generated budget increase or activation."],
  "stop_conditions": ["Budget authority or measurement plan is missing.", "Unit economics cannot bound the experiment.", "The task requests account, bid, spend, start, stop, or scale action.", "Audience safety cannot be established."],
  "handoff_contracts": {"task": "task-envelope@2", "result": "result-envelope@2"}
}
